<?xml version="1.0" encoding="UTF-8"?>
<simulation xmlns="http://www.w3schools.com" xmlns:xsi="http://www.w3.org/2001/XMLSchema-instance"
	xsi:noNamespaceSchemaLocation="src/main/resources/SimulationSchema.xsd">

	<name></name>
	<system-under-test>test</system-under-test>
	<simulators>
		<simulator>
			<id>1</id>
			<name>test</name>
			<event-content-length>100</event-content-length>
			<pause-between-events>10000</pause-between-events>
		</simulator>
	</simulators>
</simulation>